Verb,NZZ_ID,Token_ID,Sentence,pattern,Stimulus_Type,Stimulus_PP,Comment,sem_class_subj,sem_class_PP_int,interpr_sem_class_PP_int,det_PP_int,Comment_PP
beruhigen,NZZ_1998_11_03_a143_seg3_s9,9,Das sichere Gefühl biographischer Kontinuität und familialen Zusammenhangs beruhigt über die Variationen des Erscheinungsbildes .,X-STM_V,inanim,über,"variation, ambiguous, STM_psych_noun",abstract_obj,event,property,,
beschämen,NZZ_1994_07_02_a222_seg4_s9,10,"Statt nach der Rückkehr unseren aufrichtigen Dank entgegenzunehmen , beschämten sie uns mit ihrem Dank für das Privileg einer ( für sie kostenlosen ) Pilgerfahrt zu der Stätte ihrer wissenschaftlichen Leidenschaft .",X-STM_V_Y-EXP,anim,mit,,human,abstract_obj,event(action),det_coref_subj,utterance
beschämen,NZZ_1995_02_04_a224_seg35_s7,23,"« Die Begründungen dafür ergeben sich : Leben mit der Mauer , ein paar Freunde auch drüben , der eine und andere beschämt mich durch Tapferkeit , eine lange Tapferkeit . »",X-STM_V_Y-EXP,anim,durch,,human,property,,,
beschämen,NZZ_1995_09_19_a107_seg5_s8,42,"Der Band , der eine Zeittafel und ein Nachwort enthält , ist im Paderborner Igel-Verlag erschienen , der seit einigen Jahren durch mutige , abseits gängiger Literaturtrends liegende Publikationen auf sich aufmerksam macht und durch dieses Engagement die grossen deutschen Verlagshäuser beschämt , die sich als Literaturverwalter aufspielen , aber vor allem kommerzielle Interessen verfolgen .",X-STM_V_Y-EXP,anim_proxy,durch,EXP_anim_proxy,anim_proxy,event(action),,,
beschämen,NZZ_1995_10_30_a96_seg3_s8,35,"Sich aber auf Grund der neuesten Pléiade-Ausgabe auch Vorstufen , Skizzen und getilgte Partien präsent zu halten und dazu noch die riesige Korrespondenz sowie eine Unzahl zeitgenössischer Zeugnisse kritisch verarbeitet zu haben - damit beschämt Citati nicht gerade die Spezialisten , aber die Schreiber , die manches nicht ungern den Spezialisten überlassen .",X-STM_V_Y-EXP,anim,mit,pronominal_adverb,human,event(action),,,
beschämen,NZZ_1996_12_10_a166_seg3_s5,19,"An einem Spieltag gelang es gar , die Spitzenklubs der ersten Division mit dem bundesweit höchsten Publikumszuspruch zu beschämen .",X-STM_V_Y-EXP,anim,mit,"EXP_anim_proxy, ambiguous",human,event(action),property,,
beschämen,NZZ_1997_01_16_a133_seg8_s5,34,"Dass Jan Philipp Reemtsma nach seinem existentiellen Schlüsselerlebnis ein anderer ist , war schon seinen behutsamen Beiträgen zur Debatte um die Goldhagen-Thesen anzumerken , mit denen er eine selbstgefällige Historikerzunft durch seine Unvoreingenommenheit beschämte .",X-STM_V_Y-EXP,anim,"durch,mit",EXP_anim_proxy,human,abstract_obj+property,,/det_coref_subj,utterance
beschämen,NZZ_1998_03_10_a88_seg7_s17,17,Dies um die « Armen » nicht durch « Mildtätigkeit » oder « Caritas » zu beschämen .,X-STM_V_Y-EXP,anim,durch,,human,property/property,,,
beschämen,NZZ_1999_05_03_a4_seg8_s10,46,"Welchen Zweck Milosevic verfolgt , scheint auf der Hand zu liegen : Er will die Nato , die sein Land Tag für Tag bombardiert , mit einem « humanitären Akt » , für den ihm der Gegner wahrhaftig keinen unmittelbaren Anlass gegeben hat , gewissermassen beschämen und hofft wohl auch , dass die Medienberichte über diese Grossmut die Haltung der westlichen Öffentlichkeit zum Krieg beeinflussen .",X-STM_V_Y-EXP,anim,mit,EXP_anim_proxy,human,event(action),,,
beschämen,NZZ_1997_01_31_a210_seg2_s10,48,"Insofern als dieses Muster dazu dient , die nicht unbeträchtliche Mitverantwortung des Westens an den Massakern in Rwanda zu kaschieren , muss es versagen ; als Fortführung einer Weltsicht , deren Horizont sich noch zu Anfang dieses Jahrhunderts im Zoologischen Garten erübrigte , muss es nur noch beschämen .",X-STM_V,inanim,als,,abstract_obj,event(action),property,no_det,
beunruhigen,NZZ_1993_07_15_a158_seg2_s2,7,( ap ) Ein Walliser Biobauer beunruhigt die Behörden mit einem Hanfanbau in der Rhoneebene .,X-STM_V_Y-EXP,anim,mit,EXP_anim_proxy,human,"locative,concrete_obj,event(action)",event(action),,
beunruhigen,NZZ_1993_08_14_a169_seg3_s13,19,"Das « menschliche Chamäleon » Zelig , das in den zwanziger Jahren die Zeitgenossen durch eine unbegrenzte Verwandlungsfähigkeit beunruhigt , wird zum Sinnbild für Identität und Selbstverlust und damit letztlich der Problematik künstlerischer Existenz .",X-STM_V_Y-EXP,anim,durch,,human,property,,,
beunruhigen,NZZ_1993_11_04_a10_seg12_s9,4,Die jordanischen Muslimbrüder beunruhigen ihn durch ihre systematische Beeinflussung des Erziehungssystems mehr als die jüngeren politischen Islamisten .,X-STM_V_Y-EXP,anim,durch,,human,event(action),,det_coref_subj,
beunruhigen,NZZ_1994_09_13_a181_seg3_s28,42,"« Ausgerechnet Zoé » , als Fernseh-Koproduktion des Norddeutschen Rundfunks , der Vega Film Zürich und des Schweizer Fernsehens DRS entstanden , richtet sich speziell an ein jugendliches Publikum und soll offenbar die MTV-gewöhnte Generation nicht allzu stark mit harten Lebensfakten beunruhigen .",X-STM_V_Y-EXP,inanim,mit,,abstract_obj,abstract_obj,,,(part of) piece of art
bezaubern,NZZ_1993_05_22_a49_seg2_s17,16,"Corinna Kirchhoffs mondäne Dame etwa ist nicht unberührt kalt , und ihr sekttrunken entschnarchendes Harlekinmädchen bezaubert durch rührende Unschuld .",X-STM_V,anim,durch,metaphoric_STM,human,property,,,
bezaubern,NZZ_1993_07_24_a107_seg1_s55,25,"3sat , 21.50 Stephan Eicher Ein musikalisches Porträt Der erfolgreiche Berner Musiker Stephan Eicher hat als Songwriter und Rockpoet insbesondere die Schweizer und Franzosen bezaubert .",X-STM_V_Y-EXP,anim,als,,human,human/human,property/property,no_det/no_det,
bezaubern,NZZ_1993_08_30_a180_seg2_s4,3,"Ungarische Musiker bezaubern mit stimmungsvollen Zigeunerweisen , wobei es vorkommt , dass zum Beispiel der Klarinettist seine Soli in luftiger Höhe auf einem Ast des mächtigen Baumes bläst , der in der Voliere die dominierende Kulisse bildet .",X-STM_V,anim,mit,,human,abstract_obj,event(action),,(part of) piece of art
bezaubern,NZZ_1994_05_24_a107_seg4_s5,9,Auf der bei « Mangisch » eingerichteten Zweitbühne bezauberte zur selben Zeit nicht weniger effektiv die engelhaft subversive Münchner Harfenistin Susanne Weinhöppel - mit Mayonnaise-Morden und ähnlich entschlossenen Liebestaten .,X-STM_V,anim,mit,,human,"event(action),abstract_obj/event(action),abstract_obj",,,(part of) piece of art
bezaubern,NZZ_1994_11_19_a135_seg10_s20,6,Er ist entwaffnend komisch und bezaubert durch seinen Geist .,X-STM_V,ambiguous,durch,,ambiguous,abstract_obj,property,det_coref_subj,
bezaubern,NZZ_1994_11_23_a110_seg3_s4,10,"Mit Komik der feinen , eleganten und lächelnden Art bezaubert er auch in seinem neuen , in Taipeh gedrehten Film mit dem lapidaren Titel « Eat Drink Man Woman » .",X-STM_V,anim,mit,,human,abstract_obj,property,,
bezaubern,NZZ_1995_06_15_a117_seg3_s14,4,"Barbara Bonneys Eurydike bezaubert mit wunderbar hellen und zugleich beseelten Soprantönen , und Elizabeth Futral macht deutlich , dass der Knabe Amor trotz seiner neckisch-schülerhaften Kostümierung und seinen graziösen Melodien musikalisch kein Leichtgewicht ist .",X-STM_V,anim,mit,,human,abstract_obj,event(action),,"(part of) piece of art, utterance"
bezaubern,NZZ_1995_06_24_a198_seg13_s38,16,"- In der Tat : statt Figuren auf dem Schachbrett des Fussbodens zu disponieren , bezaubert Correggio mit Flugfiguren in der unabsehbaren Höhe von Empyräen .",X-STM_V,anim,mit,"ambiguous, fragment",human,event(action),,,(part of) piece of art
bezaubern,NZZ_1995_11_10_a24_seg7_s17,2,"Sie bezaubert durch ihre grosszügig angelegten Gärten , etwa den Teich des « badenden Drachen » , der von « weiblichen » und « männlichen » Wasserfällen gespeist wird .",X-STM_V,ambiguous,durch,,ambiguous,"locative,concrete_obj",property,det_coref_subj,
bezaubern,NZZ_1996_01_09_a105_seg10_s1,9,"Ein Jahr später , 1980 , überrascht und bezaubert Eco die literarische Welt mit einem Roman , dessen geheimnisvoller Titel , « Der Name der Rose » , die Pforte ist zur fernen und doch bedrängend nahe rückenden Welt des späten Mittelalters .",X-STM_V_Y-EXP,anim,mit,,human,abstract_obj,,,(part of) piece of art
bezaubern,NZZ_1996_01_27_a71_seg4_s8,2,Sie bezauberte ihr Publikum gleich mit Sommerkleidern aus Seide mit Dessins - ganzen Gemälden - von Papa .,X-STM_V_Y-EXP,anim,mit,,human,concrete_obj,,,(part of) piece of art
bezaubern,NZZ_1996_07_11_a118_seg4_s25,29,"Die Spezialität der « In Sides » -Köche sind nicht die Sounds , welche an Zeiten von Kraftwerk und vintage electronics ( analoge Geräte ) erinnern , vielmehr bezaubern sie durch das Raffinement , mit welchem sie einzelne Klangformen in intelligent zusammengestellten Loops vereinen und so ihrer Musik den typisch weichen und fliessenden Charakter verleihen .",X-STM_V,anim,durch,ambiguous,human,property,,,(part of) piece of art
bezaubern,NZZ_1997_03_01_a139_seg7_s4,29,"Zur Erleichterung des Lesers löst sich das Rätsel schliesslich : Vor fünfzehn Jahren traf der Autor einen elfjährigen Jungen , der den Mittdreissiger mit seiner Ehrlichkeit und Entschlossenheit bezauberte .",X-STM_V_Y-EXP,anim,mit,,human,property/property,,det_coref_subj,
bezaubern,NZZ_1997_12_04_a170_seg4_s16,15,"Während Dana Lynn Caruso durch ihre schüchterne Zurückhaltung und einen entzückenden Charme alle anwesenden bezaubert , macht Caroline O ' Connor mit Witz und Ironie auf sich aufmerksam .",X-STM_V_Y-EXP,anim,durch,,human,property/property,,det_coref_subj/,
bezaubern,NZZ_1997_12_13_a223_seg6_s16,2,"Sie bezaubert mit Noten von getrockneten Früchten , ist weich und schmeichelnd wie das Licht des Ozeans über der Charente .",X-STM_V,ambiguous,mit,,ambiguous,abstract_obj,property,,
bezaubern,NZZ_1998_02_13_a192_seg3_s20,32,"Der Film des in Algier geborenen und in Frankreich lebenden Tony Gatlif , Gewinner des Silbernen Leoparden am Festival von Locarno 1997 , hält sich bei ausführlichen Begründungen nicht auf , bezaubert aber durch seine schwebende Poesie , den balladenhaft improvisierenden Ton und eine Zigeunerfolklore , die nie klischiert anmutet .",X-STM_V,anim,durch,,human,property/abstract_obj/abstract_obj,property/property/property,det_coref_subj//,(part of) piece of art
bezaubern,NZZ_1998_06_13_a252_seg3_s22,10,Der wuchernde Schlingknöterich gehört zu den ausdauernden Lianen und bezaubert bis zum ersten Frost mit einer Fülle von weissen oder grünlichweissen Blüten .,X-STM_V,anim,mit,clearly_non_agentive,plant,concrete_obj,property,,
bezaubern,NZZ_1999_03_20_a272_seg3_s12,7,Dank ihrer Kleinwüchsigkeit und ungewohnten Blütenformen bezaubern sie den Gartenliebhaber .,X-STM_V_Y-EXP,anim,dank,clearly_non_agentive,plant,property/property,,det_coref_subj,
bezaubern,NZZ_1999_11_27_a212_seg3_s3,70,"Mit seiner Tierschar präsentiert Henry Gugelmann , Direktor des Zirkus Maus , der zurzeit im Einkaufszentrum Letzipark gastiert , ein vergnügliches Programm , in dem sich die Tiere offenbar wohl fühlen : Mit Handzeichen , Zureden und ab und zu einem kleinen Bissen Futter bewegt der diplomierte Tierpfleger Hunde , Katzen , Ratten , Enten , Hühner und ein Ferkel dazu , die Zuschauer mit ihrem tierischen Charme zu bezaubern .",X-STM_V_Y-EXP,anim,mit,"clearly_non_agentive, STM_coordination",animal,property,,det_coref_subj,
bezaubern,NZZ_1993_01_15_a64_seg3_s3,9,"Das von den vier begabten Loynaz-Geschwistern geführte Haus bezauberte mit seiner tropischen Opulenz und intellektuellen Verfeinerung keinen Geringeren als Federico García Lorca , der auf der Heimreise von seinem USA-Aufenthalt 1929/30 einige Zeit in Havanna verbrachte .",X-STM_V_Y-EXP,inanim,mit,,concrete_obj,property/event,property/property,det_coref_subj/,
bezaubern,NZZ_1993_04_26_a133_seg7_s25,2,"Schönenberg bezaubert den Golfer immer wieder mit eindrucksvollen Bildern einer einzigartigen Moränenlandschaft , Hittnau durch kühne Entwürfe des Architekten auf einem schwierigen Gelände und Ragaz durch den Parkcharakter seines Platzes .",X-STM_V_Y-EXP,inanim,mit,,locative,abstract_obj,property,,
bezaubern,NZZ_1993_07_29_a114_seg2_s17,15,"Stroh ist leicht , zäh , dauerhaft , schmiegsam , spannkräftig , und es bezaubert durch seinen goldenen Glanz .",X-STM_V,inanim,durch,,concrete_obj,property,,det_coref_subj,
bezaubern,NZZ_1993_08_14_a126_seg2_s139,23,"Es sind Steine , Blumen , Muscheln , Figuren , Erinnerungsbilder von Reisen , die ihre Sprache sprechen und mit ihren Formen bezaubern .",X-STM_V,inanim,mit,STM_coordination,"concrete_obj/concrete_obj/concrete_obj/abstract_obj,concrete_obj/abstract_obj,concrete_obj",property,,det_coref_subj,
bezaubern,NZZ_1993_12_27_a40_seg4_s7,5,Bei aller Düsternis jedoch bezaubert das Werk durch seine lyrische Sprache .,X-STM_V,inanim,durch,,abstract_obj,abstract_obj,property,det_coref_subj,(part of) piece of art
bezaubern,NZZ_1994_01_15_a106_seg3_s3,53,"Was wäre geschehen , wäre Kleopatras Nase kürzer gewesen ; hätte Napoleon bei Waterloo gewonnen ... Von solchen uchronischen Modellen geht Carrère aus , und schliesslich kommt ein ganz beachtlicher Essay zustande , der den Lesenden durch das Getriebe einer zeitüberhobenen Imagination schleust und ihn dabei gleichzeitig , ja : notwendig damit bezaubert , die Vergangenheit ganz anders zu denken , als sie « wirklich » gewesen ist .",X-STM_V_Y-EXP,inanim,mit,pronominal_adverb,abstract_obj,abstract_obj,property,,(part of) piece of art
bezaubern,NZZ_1994_05_17_a106_seg3_s17,4,Die frühen Collagen bezaubern durch ihre poetische Schwerelosigkeit .,X-STM_V,inanim,durch,,concrete_obj,property,,det_coref_subj,(part of) piece of art
bezaubern,NZZ_1994_08_12_a123_seg3_s10,28,"1969 hat Irina Poplawskaja nach Tschingis Aitmatows Erzählung einen Film von herber Schönheit und melancholischer Poesie gestaltet , einen Liebesgesang , der durch seine Reinheit und Unschuld bezaubert .",X-STM_V,inanim,durch,,abstract_obj,property/property,,det_coref_subj,(part of) piece of art
bezaubern,NZZ_1994_11_11_a168_seg3_s16,11,"Vor mehr als 30 Jahren von Olle Hellbom verfilmt , bezaubert Astrid Lindgrens Klassiker dank seiner Mischung aus Schabernack und kuriosen Zufällen auch heute noch .",X-STM_V,inanim,dank,,abstract_obj,property,,det_coref_subj,(part of) piece of art
bezaubern,NZZ_1995_07_03_a95_seg5_s1,32,"Der 28jährige Österreicher Franzobel hat den diesjährigen Klagenfurter Ingeborg-Bachmann-Wettbewerb für sich entschieden - mit einem Text , der als « Minimal Music » mit virtuosen spätdadaistischen Einsprengseln die Ohren der Jury bezauberte .",X-STM_V_Y-EXP,inanim,mit,EXP-related_object,abstract_obj,abstract_obj,property,,(part of) piece of art
bezaubern,NZZ_1996_03_09_a151_seg23_s3,2,"Bali bezauberte schon früh durch seine Kunst und einzigartige Kultur - eine Insel , die den Paradiesbegriff touristisch ausschlachtet .",X-STM_V,inanim,durch,,locative,abstract_obj/abstract_obj,,det_coref_subj,
bezaubern,NZZ_1996_05_25_a255_seg8_s9,4,"Die kindliche Phantasie bezaubert durch den Trick , Orte ständig neu zu definieren , Welten zu erschaffen und Kontinente voneinander abzugrenzen durch Zelte , Bauklötze oder Stühle .",X-STM_V,inanim,durch,,"abstract_obj,property",abstract_obj,property,,
bezaubern,NZZ_1996_07_18_a141_seg2_s12,4,Seit zweihundert Jahren bezaubern die Musikdosen mit feinen Klängen .,X-STM_V,inanim,mit,,concrete_obj,"abstract_obj,event",property,,
bezaubern,NZZ_1997_01_25_a31_seg3_s3,5,"Die autofreie Innenstadt Kurashikis bezaubert durch architektonische Kompaktheit , sorgsam gepflegte Gärten und Alleen , die sich Kanälen entlangziehen , in denen Enten , Schwäne und Karpfen prächtig gedeihen .",X-STM_V,inanim,durch,,"concrete_obj,locative",property/concrete_obj/concrete_obj,property/property/property,,
bezaubern,NZZ_1997_09_20_a229_seg3_s54,3,Die Dörfer bezaubern mit ihrem ländlichen Charme und dem « unverdorbenen » Charakter der Landschaft .,X-STM_V,inanim,mit,,locative,property/property,,det_coref_subj/,
bezaubern,NZZ_1997_11_20_a209_seg3_s9,6,Die Räume der oberen Etagen bezaubern zudem durch den Blick auf eine herrliche Landschaft .,X-STM_V,inanim,durch,,concrete_obj,abstract_obj,property,,
bezaubern,NZZ_1997_12_20_a50_seg10_s10,20,"Trotz den bunten spätbarocken Heiligenstatuen der Kirche , die ihn an die unzähligen Göttergestalten seiner heimatlichen Tempel erinnern , bezaubert ihn die Madonna in der düsteren Kapelle mit dem geheimnisvollen Lächeln ungleich stärker .",X-STM_V_Y-EXP,inanim,mit,ambiguous,concrete_obj,"abstract_obj,event",property,,(part of) piece of art
bezaubern,NZZ_1998_08_20_a224_seg7_s2,10,"Und imponieren in der Ajoie die Dimensionen , so bezaubern im Zugerland die nuancierten Farbtöne .",X-STM_V,inanim,in,,property,locative,,,
bezaubern,NZZ_1999_02_13_a260_seg3_s33,23,"Rund siebzig Arten sind in Cina heimisch , deren weisse bis rosafarbene Blüten vor allem auch durch ihren wohlriechenden , süssen Duft bezaubern .",X-STM_V_Y-EXP,inanim,durch,,concrete_obj,abstract_obj,property,det_coref_subj,
bezaubern,NZZ_1999_03_25_a255_seg8_s22,15,Noch ein Halt auf den Brissagoinseln der Botanische Garten auf der Isola Grande bezaubert durch eine einzigartige subtropische und exotische Vegetation .,X-STM_V,inanim,durch,,locative,property,,,
bezaubern,NZZ_1999_07_24_a210_seg2_s2,30,Im Garten indes wird das Wasser gezähmt und kann als kleinstes Becken oder als grosszügiger Teich eine ungewöhnliche Wirkung entfalten und den Betrachter im Jahresverlauf mit immer neuen Ansichten bezaubern .,X-STM_V_Y-EXP,inanim,mit,,material,abstract_obj,property,,
bezaubern,NZZ_1999_08_19_a208_seg3_s5,4,Das einfache Landgasthaus bezaubert mit seiner Einrichtung aus der Jahrhundertwende ( www.Whitman.ns .,X-STM_V_Y-EXP,inanim,mit,fragment,concrete_obj,concrete_obj,property,det_coref_subj,
bezaubern,NZZ_1999_09_11_a175_seg3_s2,6,"Es gibt Musikinstrumente , die bezaubern durch Schönheit , Perfektion , die Aura - und nicht zuletzt auch durch ihren Namen .",X-STM_V,inanim,durch,,concrete_obj,property/property/abstract_obj/abstract_obj,property/property/property,///det_coref_subj,
deprimieren,NZZ_1999_11_23_a184_seg3_s22,56,"Mit bösen Vorahnungen lud ich meine vorletztjährigen , klisterverklebten Fischer-RCS X2 Cold Fiber in den Kofferraum eines VW Saphan Kombi , der zwei anderen Nachbarn gehört , die soeben samt ihren fabrikneuen Atomic ATC mit Digital Flex und Ultra-Densolite-Kern nach Lappland abgeflogen sind , um ihre daheimgebliebenen Langlaufkollegen schon Ende November mit vierstelligen Schneekilometer-Zahlen zu deprimieren .",X-STM_V_Y-EXP,anim,mit,,human,abstract_obj,property,,
einleuchten,NZZ_1999_01_07_a132_seg9_s3,14,"Es gibt kaum einen Anderen , der als Mensch so leuchtet , so einleuchtet .",X-STM_V,anim,als,,human,human,property,no_det,
einleuchten,NZZ_1994_02_04_a119_seg5_s5,23,"Die Rücksichtnahme auf ihre drei Kinder zwischen 11 und 18 Jahren und auf die beruflichen Verpflichtungen ihres im diplomatischen Dienst tätigen Mannes leuchtet als Grund für die Absage an den Parteipräsidenten ein , der sie gerne definitiv auf den Posten des Generalsekretärs gehievt hätte .",X-STM_V,inanim,als,,"abstract_obj,event(action)",abstract_obj,,no_det,
einleuchten,NZZ_1998_05_02_a249_seg11_s4,18,"Yillahs Verschwinden , das im Roman genausowenig geklärt werden wird , wie Taji sie lebend wiedersieht , leuchtet vor allem als Denkfigur ein , durch die Melville die eigentliche Konstellation dieser Reise in die Moderne schafft : mit der jungen Frau ist der Inbegriff vormoderner Unschuld in dem Augenblick vergangen und zum halluzinativen Ziel der Reise geworden , da im Kapitel « Ein unbekanntes Wesen » mit der Königin Hautia eine keineswegs unschuldige , sondern unheimliche und verführerische Frauenfigur im Roman auftaucht .",X-STM_V,inanim,als,,event,abstract_obj,,no_det,
einschüchtern,NZZ_1993_03_20_a161_seg2_s109,21,"Er habe in einem peripheren Stadtteil einen aus Togo getroffen und angesprochen , ihn jedoch mit seinen naseweisen Journalistenfragen nur eingeschüchtert .",X-STM_V_Y-EXP,anim,mit,,human,abstract_obj,event(action),det_coref_subj,utterance
einschüchtern,NZZ_1993_04_02_a31_seg6_s2,17,Laut der Meinung vieler Konservativer führte Keating eine Kampagne der Angst und hat damit viele Wähler eingeschüchtert .,X-STM_V_Y-EXP,anim,mit,pronominal_adverb,human,event(action),,,
einschüchtern,NZZ_1993_07_03_a112_seg1_s9,15,"Als seine Komplizen , beide viel älter als Eddie , ins Haus zurückkehren , schüchtern sie Patricia durch brutale Gewaltakte ein und halten ihr Weinen auf Tonband fest .",X-STM_V_Y-EXP,anim,durch,,human,event(action),,,
einschüchtern,NZZ_1993_08_27_a96_seg3_s13,22,Der unermüdliche Kämpfer mit enormem Teamgeist weiss wie kein anderer die Mitspieler mitzureissen und die Gegner allein schon durch die Anwesenheit einzuschüchtern .,X-STM_V_Y-EXP,anim,durch,,human,property,,,
einschüchtern,NZZ_1994_02_12_a51_seg3_s2,68,"So berichtet die Wochenzeitung « Le Nouvel Economiste » in ihrer jüngsten Ausgabe , dass sich in den Reihen der französischen Banken die Meinung durchsetze , dem Schuldner und besonders dem amerikanischen Mutterhaus die Stirne zu bieten , nachdem die Walt Disney Corporation offenbar mit Erfolg versucht hatte , die Banken mit der Drohung , sie werde den verlustbringenden Park im Osten von Paris wieder schliessen , einzuschüchtern und zu einem Einlenken in den Umschuldungsverhandlungen zu bewegen .",X-STM_V_Y-EXP,anim_proxy,mit,EXP_anim_proxy,anim_proxy,"event(action),abstract_obj",event(action),,utterance
einschüchtern,NZZ_1994_03_18_a21_seg6_s5,42,"Das Abseitsstehen Russlands hat in der Nato nicht geringe Besorgnis hervorgerufen , zumal die Regierung in Moskau seit einigen Monaten zunehmend in schon überwunden geglaubtes Verhalten zurückgefallen ist , die wirtschaftlichen Reformbemühungen aufgegeben , die baltischen Staaten mit extrem rüden Tönen eingeschüchtert und die westliche Politik im Bosnien-Konflikt in aller Schärfe kritisiert hat .",X-STM_V_Y-EXP,anim_proxy,mit,EXP_anim_proxy,anim_proxy,abstract_obj,event(action),,
einschüchtern,NZZ_1994_06_24_a105_seg2_s2,8,"Wie üblich geworden , suchte man sie einzuschüchtern und zu verunsichern durch Anwürfe wie « kleinkariert » , « kulturlos » , dem « Mythos der Neutralität » verhaftet usw.",X-STM_V_Y-EXP,anim,durch,,human,"abstract_obj,event(action)",event(action),,utterance
einschüchtern,NZZ_1994_07_28_a26_seg10_s5,9,Deutsche Fernsehanstalten hätten durch falsche Berichterstattung die Touristen eingeschüchtert .,X-STM_V_Y-EXP,anim_proxy,durch,,anim_proxy,event(action),,no_det,utterance
einschüchtern,NZZ_1995_12_04_a18_seg2_s7,19,"Es lässt sich nun trefflich darüber spekulieren , ob und wie stark Peking mit seinem Säbelrasseln die Taiwaner eingeschüchtert und sie davon abgehalten hat , der DPP an die Macht zu verhelfen .",X-STM_V_Y-EXP,inanim,mit,"ambiguous,metonymic_STM","abstract_obj,locative",event(action),,det_coref_subj,
entmutigen,NZZ_1993_11_09_a85_seg4_s9,20,"Der Staatsrat steht vor der heiklen Aufgabe , keines der beiden Komitees durch die vorzeitige Definition einer Priorität zu entmutigen ; man wünscht sich den Erfolg der einen , aber schwerlich den beider Initiativen .",X-STM_V_Y-EXP,anim_proxy,durch,EXP_anim_proxy,anim_proxy,event(action),,,
entmutigen,NZZ_1997_05_15_a217_seg5_s56,27,"Das führt zur Kernfrage : Wenn doch jedweiliges Eingehen auf die Zeichnung unglückliche Auswirkungen veranlasst , soll man denn durch « verächtliche Gleichgültigkeit » das Kind entmutigen ?",X-STM_V_Y-EXP,anim,durch,,human,property,,,
entmutigen,NZZ_1998_04_03_a33_seg11_s15,13,"Durch kulturelle Modelle , die existieren und durch ihre Existenz ermutigen oder entmutigen und von den so Ermutigten bzw. Entmutigten bekräftigt werden .",X-STM_V,inanim,durch,,abstract_obj,property,,det_coref_subj,
entzücken,NZZ_1993_01_21_a67_seg2_s3,25,"Und wenn derjenige , der sie schreibt , Phantasie besitzt , kann er uns ebenso mit der minuziösen , photographisch getreuen Beschreibung imaginärer Landschaften entzücken wie mit der zwangsläufig weniger minuziösen Beschreibung der Landschaften , die er zu sehen glaubt . »",X-STM_V_Y-EXP,anim,mit,,human,"event(action),abstract_obj",,,"utterance, (part of) piece of art"
entzücken,NZZ_1993_02_16_a143_seg4_s12,30,"Diese Geschichte wäre an und für sich kaum erwähnenswert , würde es sich bei Roy nicht um einen hochtalentierten 23jährigen Internationalen handeln , der als genialer Dribbelkünstler die Massen entzückte .",X-STM_V_Y-EXP,anim,als,,human,human,property,no_det,
entzücken,NZZ_1993_05_28_a49_seg4_s1,29,"Jane Campion hat das Kino nicht neu erfunden , aber die junge Regisseurin - die in Cannes Publikum und Presse mit ihrer Natürlichkeit und ihrem augenfällig hochschwangeren Zustand entzückte - überflügelte mit der formalen und emotionalen Kraft ihres dritten Spielfilms - nach « Sweetie » und « An Angel at My Table » - mühelos Autoren von ungleich bedeutenderem Renommee oder Bekanntheitsgrad .",X-STM_V_Y-EXP,anim,mit,"EXP_coordination, EXP_anim_proxy",human,property/state,property/property,det_coref_subj/det_coref_subj,
entzücken,NZZ_1993_10_12_a88_seg8_s2,57,"Zwar ist der legendäre Roger Milla nur noch im Betreuerstab dabei , aber Torhüter Bell , die Halbbrüder Omam-Biyik und Kana-Biyik , Pagal und der in letzter Zeit häufig verletzte Captain Stephen Tataw sind fünf Spieler im derzeitigen Kader , die bereits 1990 in Italien dabeigewesen waren , als Kamerun die Fussballwelt mit dem frisch-fröhlichen Angriffsfussball entzückte .",X-STM_V_Y-EXP,anim_proxy,mit,EXP_anim_proxy,anim_proxy,event(action),,,
entzücken,NZZ_1995_01_30_a8_seg5_s2,22,"Mit dem Slogan « Kill the Boer , kill the farmer » ( töte den Buren , töte den Farmer ) entzückte er zwar seine Anhänger , nicht aber die oberste Führung seiner Organisation , die um ihren Ruf bei den Weissen fürchtete .",X-STM_V_Y-EXP,anim,mit,,human,abstract_obj,,,utterance
