Verb,NZZ_ID,Token_ID,Sentence,pattern,Stimulus_Type,Stimulus_PP,Comment,sem_class_subj,sem_class_PP_int,interpr_sem_class_PP_int,det_PP_int,Comment_PP
imponieren,NZZ_1996_09_25_a197_seg3_s3,33,"Verdientermassen , sei gleich beigefügt , denn die Romands deckten die Schwächen des in der Champions-League-Vorrunde an Rapid Wien gescheiterten , auch am Dienstag auf allen Linien enttäuschenden Favoriten resolut auf , imponierten durch ihre vortreffliche Gruppierung im Raum , durch technische Fertigkeit wie hohes athletisches Engagement .",X-STM_V,anim,durch,,human,"event(action),abstract_obj+property/property",property+property/property,det_coref_subj+/,
imponieren,NZZ_1996_10_07_a126_seg3_s25,12,"Vor Länderspielkulisse überzeugte Elber mit einer Weltklasseleistung , und dessen Kollegen imponierten durch Leidenschaft .",X-STM_V,anim,durch,,human,property,,,
imponieren,NZZ_1996_10_09_a107_seg3_s15,92,"Man mag es als späte Ironie des Schicksals lesen , dass es ein rein amerikanisches Solistentrio war , das entscheidend zu dieser musikalischen Rehabilitation beitrug : James O ' Neal als der narzisstische Ästhet Kandaules , Monte Pederson als sein Tatmensch-Gegenspieler Gyges und Nina Warren als Königin Nyssia , die von der blossen Spielfigur in Kandaules ' Händen zur entschlossen ( und verhängnisvoll ) Handelnden mutiert , verliehen den drei Hauptcharakteren der schon von Herodot protokollierten Geschichte vokales und szenisches Format , wobei zumal Pederson durch mächtige Sonorität und dramatische Präsenz imponierte .",X-STM_V,anim,durch,,human,property/property,,,"(part of) piece of art, utterance"
imponieren,NZZ_1996_10_16_a166_seg4_s7,4,"Die schwedische Equipe imponierte durch Wucht , Zweikampfstärke und Hartnäckigkeit .",X-STM_V,anim_proxy,durch,,anim_proxy,property/property/property,,,
imponieren,NZZ_1996_10_21_a143_seg3_s3,19,"Den Münchnern , vor allem ihrem Goalgetter Klinsmann , hatten sich die besseren Torchancen geboten , die Borussen imponierten durch Kampfgeist und mit einer geschlossenen Mannschaft .",X-STM_V,anim,"durch,mit",,human,property+anim_proxy,property+property,,
imponieren,NZZ_1996_11_01_a158_seg3_s13,25,"Sie trafen jedenfalls gar keine Anstalten , sich mit der Aussenseiterrolle zu begnügen und den Schaden möglichst gering zu halten , wirkten selbstbewusst und imponierten durch mentale wie physische Präsenz auf jeder Position .",X-STM_V,anim,durch,,human,abstract_obj/abstract_obj,property/property,,ambiguous
imponieren,NZZ_1996_11_09_a204_seg4_s8,48,"Wirft man dann noch einen Blick auf die Kaderliste für das Schweiz-Spiel und entdeckt , dass die Hälfte der 18 aufgebotenen Spieler in England ihr Brot verdient , und hat man vergessen , dass die ehemaligen YB-Cracks Mini Jakobsen und Lars Bohinen nicht gerade mit einer Holzfäller-Statur imponierten - ja , dann ist man schon ein wenig überrascht , als man Erik Mykland gegenüber sitzt , denn Mykland ist 1,72 m gross und 60 kg schwer .",X-STM_V,anim,mit,STM_coordination,human,property,,,
imponieren,NZZ_1996_11_23_a201_seg3_s16,3,"Den Amerikanern imponieren will sie mit ihrem lockeren Auftreten auf dem Platz , ihrem Lachen und ihrer Angewohnheit , den Emotionen freien Lauf zu lassen und auch einmal das Racket hinzuschmeissen .",X-STM_V_Y-EXP,anim,mit,,human,event(action)/event(action)/property,property/property/property,det_coref_subj/det_coref_subj/det_coref_subj,
imponieren,NZZ_1996_12_21_a177_seg3_s11,20,Den Damenwettbewerb von Innsbruck gewann die Zürcherin Denise Biellmann mit deutlichem Vorsprung ;  sie zeigte die besten Sprünge und imponierte durch ihre dynamische Ausstrahlung .,X-STM_V,anim,durch,,human,property,,det_coref_subj,
imponieren,NZZ_1997_01_04_a4_seg22_s1,5,"Während andere jammern , imponiert die Zürcher Buchhandlungsbranche mit antizyklischem Muskelspiel : es wird expandiert und experimentiert mit dem Ziel , den Buchkonsum zum sinnlichen Erlebnis zu machen .",X-STM_V,anim_proxy,mit,,anim_proxy,"abstract_obj,event(action)","event(action),property",,
imponieren,NZZ_1993_03_16_a34_seg4_s1,16,"Der von der CBR 1000 F entlehnte , aber mit nur fünf Getriebestufen agierende Reihenvierzylinder imponiert mit bulliger Leistungsabgabe .",X-STM_V,inanim,mit,,concrete_obj,abstract_obj,property,no_det,
imponieren,NZZ_1993_04_19_a41_seg3_s13,8,In Mozarts B-Dur-Sinfonie KV 319 zum Abschluss imponierten die intensiv durchpulste Musikantik und zugleich die inspirierte Promptheit dieser Darstellung .,X-STM_V,inanim,in,ambiguous,property,"abstract_obj,event",,,(part of) piece of art
imponieren,NZZ_1994_02_08_a192_seg11_s8,16,"Wenn auch das Innere , ganz im Gegensatz zum Äusseren , mehr durch seine Grösse imponiert - 250 m lang , 96 m breit , 36 m hoch und damit der Welt grösste Leimholzträger- Konstruktion - als durch ein sorgfältig entworfenes Tragwerk oder andere Details , so überwiegt doch das Positive im Gesamturteil dieses Bauwerkes .",X-STM_V,inanim,durch,,concrete_obj,property,,det_coref_subj,
imponieren,NZZ_1994_03_29_a174_seg3_s24,4,"Was an Reyna imponiert , ist neben der stupenden Technik vor allem die bewundernswerte mentale Stärke .",X-STM_V,inanim,an,,"property,abstract_obj",human,,,
imponieren,NZZ_1994_04_16_a198_seg4_s4,5,"Was im GC-Team besonders imponierte , waren die Ausgeglichenheit , die verblüffende Rentrée Bickels , dem kaum einer die lange Pause anmerkte , die Moral und die technische Ausbildung , der auch vom Genfer Publikum die Anerkennung nicht versagt blieb .",X-STM_V,inanim,in,"ambiguous, STM_coordination",property/event(action)/property/property,anim_proxy,,,
imponieren,NZZ_1994_05_10_a176_seg6_s7,4,"In der Tat imponiert das Fahrzeug schon auf den ersten Autobahnkilometern mit Reisewagenqualitäten , die ihresgleichen suchen .",X-STM_V,inanim,mit,,concrete_obj,property,,,
imponieren,NZZ_1994_06_10_a121_seg7_s1,4,Die weltgrösste Hundeausstellung imponiert primär durch die Formenvielfalt .,X-STM_V,inanim,durch,,event,property,,,
imponieren,NZZ_1995_01_30_a14_seg10_s4,3,"An Berlusconi imponiert ihnen der Machertyp , an Fini die Zurückhaltung .",X-STM_V_Y-EXP,inanim,an,,"abstract_obj,property",human,,,
imponieren,NZZ_1995_02_11_a197_seg11_s1,6,"« Kultur und Imperialismus » imponiert durch subtile Analysen , durch umfassende Bildung und Fachwissen , durch das moralische Engagement , das das Buch zum Ausdruck bringt .",X-STM_V,inanim,durch,title,abstract_obj,"abstract_obj,event+abstract_obj,property/abstract_obj+event",property+property/property+property,,(part of) piece of art
imponieren,NZZ_1995_02_23_a183_seg4_s7,11,Mit immerhin zehn Viertausendern und 400 Gipfeln über 3000 Metern imponiert er als Nordafrikas mächtigstes Gebirge .,X-STM_V,inanim,"als,mit",,"locative,concrete_obj",concrete_obj+concrete_obj/concrete_obj,property/property/property,,
imponieren,NZZ_1995_06_17_a116_seg3_s10,23,"Zum gegenwärtigen Londoner Messeangebot bleibt zu sagen , dass an der Fine Art and Antiques Fair von Olympia wie immer die Vielfältigkeit imponiert .",X-STM_V,inanim,an,,property,event,,,
imponieren,NZZ_1995_11_10_a24_seg5_s3,14,"Die Palastbauten , die zumeist aus der Mitte des letzten Jahrhunderts stammen , imponieren durch Grösse , Ausgewogenheit und Schlichtheit ; auf dem Rundgang sind fast keine Ornamente zu entdecken .",X-STM_V,inanim,durch,,concrete_obj,property/property/property,,,
imponieren,NZZ_1996_04_23_a202_seg4_s7,31,"Leistungsmässig lässt schon das 1,4-l-Modell ( 214 Si ) kaum Wünsche offen ( 0-100 km/h in 10,7 s , Spitze 185 km/h ) ; der 1,6-Liter ( 216 Si ) imponiert vor allem mit seinem ausgezeichneten Durchzugsvermögen - er ist wahlweise mit einer stufenlosen CVT-Getriebeautomatik lieferbar - , während der 1,8-Liter ( 200 vi ) , welcher über die auch im MG F verwendete Motorisierung verfügt , bereits eindeutig sportliche Leistungswerte erbringt ( 0-100 km/h in 8,0 s , Spitze 205 km/h ) .",X-STM_V,inanim,mit,,concrete_obj,property,,det_coref_subj,
imponieren,NZZ_1996_05_13_a112_seg6_s2,10,"Selbst die im Grunde martialischen Kampfsportarten wie Kung Fu imponierten nicht primär durch ihre attraktiven Sprünge und Schläge , sondern vielmehr durch ihre philosophischen , taoistischen Vorstellungen , die physisch umgesetzt werden .",X-STM_V,inanim,durch,,abstract_obj,event(action)/event(action)/abstract_obj,property/property/property,det_coref_subj//det_coref_subj,
imponieren,NZZ_1996_07_19_a156_seg13_s7,27,"Es ist ein Querschnitt aus bisherigen Veröffentlichungen , der aber , mit Originalbeiträgen ergänzt , in seiner Gesamtheit , sozusagen als Einblick in ein Lebenswerk , imponiert .",X-STM_V,inanim,als,,abstract_obj,"abstract_obj,event",,no_det,(part of) piece of art
imponieren,NZZ_1996_07_31_a125_seg9_s15,26,"Das Fortschreiten ( oder Stagnieren ) ist ablesbar an den « Falschheiten » , die uns je nachdem als Fehler stören oder als kreative Leistungen imponieren .",X-STM_V_Y-EXP,inanim,als,,abstract_obj,abstract_obj+abstract_obj,,,
imponieren,NZZ_1996_08_02_a201_seg8_s4,17,"So vermittelt sich insgesamt ein Eindruck , der auf der Höhe der Zeit nicht mit Masse imponiert , sondern durch zurückhaltende , bestechende Qualität , von innen heraus .",X-STM_V,inanim,mit,,abstract_obj,property/property,,,
imponieren,NZZ_1996_08_22_a204_seg5_s1,4,"« Die Gesellschaftsräume imponieren durch ihre Grösse und ihre vornehme Einfachheit » schrieb die « Engadiner Post » vor hundert Jahren über das exklusive neue Hotel , das Caspar Badrutt , Sohn des « Erfinders » des alpinen Wintertourismus Johannes Badrutt und Grossvater der heutigen Besitzer , der Brüder Andrea und Hansjürg Badrutt , in dreijähriger Bauzeit aus der ehemaligen Pension Beau Rivage hatte erstehen lassen .",X-STM_V,inanim,durch,,concrete_obj,property/property,,det_coref_subj/det_coref_subj,
imponieren,NZZ_1996_09_21_a161_seg3_s5,10,"Ein Hosenanzug beispielsweise , Streifen und Karos gemixt , imponiert mit seiner klaren Linienführung , auch ein Trenchcoat aus Chintz weiss in aller Einfachheit zu glänzen .",X-STM_V,inanim,mit,,concrete_obj,property,,det_coref_subj,
imponieren,NZZ_1996_10_12_a203_seg3_s5,26,"Kaum ein Neubau wurde in den vergangenen 50 Jahren an einen Architekten von Rang vergeben ,  und selbst die Bauten der Europäischen Gemeinschaft in Brüssel imponieren eher durch ihre Dimensionen als durch ihre Qualität .",X-STM_V,inanim,durch,,concrete_obj,property+property,,det_coref_subj+det_coref_subj,
imponieren,NZZ_1997_01_09_a124_seg3_s2,15,Seine Abhandlung über « Männerphantasien » und seine Tetralogie « Buch der Könige » imponieren nicht zuletzt durch ihre korpulente Überwertigkeit .,X-STM_V,inanim,durch,"STM_coordination, title",abstract_obj/abstract_obj,property,,det_coref_subj,(part of) piece of art
imponieren,NZZ_1997_06_19_a212_seg5_s1,5,- « Die Adoleszenz imponiert durch ihre Frivolität .,X-STM_V,inanim,durch,,"abstract_obj,event,state",property,,det_coref_subj,
imponieren,NZZ_1997_03_13_a193_seg3_s17,5,"In der Mannschaft Loews imponierte , wie sie schon nach einer Minute der Rückstand aufholte , wie uneigennützig sich immer wieder die Goalgetter Bobic und Elber in Szene setzten und wie nüchtern der Libero Verlaat und dessen Kollegen den ersten Sieg seit langer Zeit im Rheinland analysierten .",X-STM_V,propositional,in,"ambiguous,ungrammatical, STM_coordination",property,anim_proxy,,,
imponieren,NZZ_1997_04_14_a144_seg3_s8,19,"Besonders bis kurz vor dem Pausenpfiff sah man ein Aargauer Team , das mit verwirrenden Kombinationen und Seitenwechseln imponierte , ein weit vorne angesetztes Pressing konsequent durchhielt und damit auch Schwächen in der gegnerischen Abwehr schonungslos aufdeckte .",X-STM_V,anim_proxy,mit,,anim_proxy,event(action)/event(action),property/property,,"ambiguous: property on split stimulus reading, event on instrumental reading"
imponieren,NZZ_1997_05_15_a211_seg7_s10,2,Adoleszente imponieren immer wieder durch die Absolutheit ihrer Urteile .,X-STM_V,anim,durch,,human,property,,,complex case: Absolutheit is not a property of the Adoleszente but of their Urteile. Nevertheless the PP gets a property reading: It is a feature of them that their judgments are absolute.
imponieren,NZZ_1997_05_22_a196_seg4_s27,11,"Inter schien mehr Kraft zu haben , die Schalker aber imponierten durch ihren Willen , unbedingt den 1 : 0-Vorsprung aus dem Hinspiel über die Zeit zu bringen .",X-STM_V,anim,durch,,human,abstract_obj,property,det_coref_subj,
imponieren,NZZ_1997_06_09_a171_seg3_s17,11,Die in den blaugelben Staatsfarben spielende Mannschaft von Dynamo Kiew imponierte durch Direktspiel und grossartiges Engagement .,X-STM_V,anim_proxy,durch,,anim_proxy,abstract_obj/abstract_obj,property/property,,cannot be events since atelic (therefore also mass-noun like behaviour → no no_det)
imponieren,NZZ_1997_08_16_a190_seg3_s20,7,"Auch von dieser Szene abgesehen , imponierten die Zentralschweizer mit ihrem unbändigen Kampfgeist und ihrer Physis .",X-STM_V,anim,mit,,human,"abstract_obj/abstract_obj,property",property/property,det_coref_subj/det_coref_subj,
imponieren,NZZ_1997_10_01_a115_seg3_s8,7,"Biberti , gross an Wuchs , imponierte , wenn er nur die Bühne betrat , durch seine robuste Präsenz ; er überrollte , mit einer tiefen Stimme ausgestattet , sein Publikum mit Donnergewalt , mit Pathos .",X-STM_V,anim,durch,,human,property,,det_coref_subj,Präsenz generally ambiguous but robuste Präsenz must be a property
imponieren,NZZ_1997_12_08_a147_seg3_s9,10,"Weder stehen Weber herausragende Fussballer zur Verfügung , noch imponierte das Team durch eine verblüffende Spielkultur .",X-STM_V,anim_proxy,durch,,anim_proxy,abstract_obj,property,,
interessieren,NZZ_1994_10_28_a157_seg3_s13,6,"An der « history » interessiert ihn die « story » , und dafür ist Mary ein blumiges Sujet .",X-STM_V_Y-EXP,inanim,an,,abstract_obj,abstract_obj,,,
interessieren,NZZ_1995_04_21_a116_seg7_s1,18,"Einleitend - per Video oder im Katalogtext - erklärt Jean Nouvel , was ihn am gegenwärtigen Design interessiert : nämlich die Tendenz zum Minimalismus .",X-STM_V_Y-EXP,inanim,an,,property,abstract_obj,,,(part of) piece of art
interessieren,NZZ_1995_05_11_a114_seg5_s10,8,"Nur die Durchsetzung eigener Pläne scheint zu interessieren an dem Haus , das Kollege Müller , nun alleiniger Chef , aus musealer DDR-Starre zu neuem Leben erwecken muss und will .",X-STM_V,inanim,an,,event(action),concrete_obj,,,
interessieren,NZZ_1995_10_11_a146_seg3_s21,15,"Sein Ideal sei dasjenige des Belcanto : Die dramatische Intensität des Gesanges vor allem interessiere ihn an Barock und Renaissance ; spärliches Vibrato und fast instrumentale Klanggestaltung , das sei nicht seine Art zu singen .",X-STM_V_Y-EXP,inanim,an,,"abstract_obj,temporal/abstract_obj,tempral",property,,,
interessieren,NZZ_1996_02_09_a129_seg4_s15,13,"Es lässt sich leicht denken , was Terence Davies an diesem Stoff interessiert hat : die Situation des kleinen Buben , aufgehoben in der Liebe zweier Frauen , der Mutter ( Diana Scarwid ) und deren Schwester , der faszinierenden Tante Mae , einer Nachtklubsängerin ( von Gena Rowlands mit aller erdenklichen Vitalität ausgestattet ) , die in der heuchlerisch-verhockten Provinz schärfstes Misstrauen hervorrufen muss .",X-STM_V_Y-EXP,inanim,an,,abstract_obj,abstract_obj,,,
interessieren,NZZ_1997_05_17_a33_seg15_s1,5,"An der schweizerischen Problematik interessiert aus amerikanischer Perspektive vor allem die Frage , von welchem Nutzen dieses Land mit seiner Neutralität für den Kriegsgegner gewesen sei .",X-STM_V,inanim,an,"PA+A,EXP-indicating_adjunct",abstract_obj,abstract_obj,,,
interessieren,NZZ_1998_02_20_a151_seg3_s10,4,"Den ausländischen Besucher interessiert hierbei - mehr noch als das Programm - die Tatsache , dass in Nantes ein gut Teil der französischen Interpretenaufsteiger und der Fixsterne des nationalen Musiklebens vertreten ist .",X-STM_V_Y-EXP,inanim,bei,"PA+A, pronominal_adverb",abstract_obj,ambiguous,,,
interessieren,NZZ_1999_11_19_a225_seg2_s22,11,"Mit andern Worten : Geschäft ist Geschäft , und Demokratie interessiert dabei nicht .",X-STM_V,inanim,bei,pronominal_adverb,abstract_obj,"abstract_obj,event",,,
interessieren,NZZ_1998_10_26_a111_seg3_s16,41,"- Der wenig magische Abend hat die Stärken und Schwächen , wie sie für Bachmann-Inszenierungen typisch zu werden scheinen : Er verführt die Schauspieler zu erfinderischer Spiellust , aber es bleibt dabei unklar , was ihn an dem Stück wirklich interessiert .",X-STM_V_Y-EXP,ambiguous,an,fragment,ambiguous,abstract_obj,,,
irritieren,NZZ_1993_01_28_a97_seg2_s1,11,"Die neue Maturitätsverordnung fasziniert zunächst durch ein anspruchsvolles Bildungsziel , irritiert sodann durch die nicht nachvollziehbare Anwendung des Begriffes « Lernbereiche » und enttäuscht schliesslich durch die Detailregelungen , welche das Erreichen der Zielsetzung nicht gestatten .",X-STM_V,inanim,durch,,abstract_obj,"abstract_obj,event(action)",property,,
irritieren,NZZ_1993_03_12_a64_seg2_s24,42,"Weit mehr als beim Studentenwohnheim von Herzog & de Meuron in Dijon , wo die formale Abstraktion befremden mag , überzeugt bei diesem Privatmuseum das Hermetische einer künstlerischen Haltung , die durch die Parallelität von sinnlichen , rationalen und poetischen Aspekten irritiert .",X-STM_V,inanim,durch,,"abstract_obj,state",property,,,
irritieren,NZZ_1993_03_20_a157_seg2_s31,8,Das gewisse Lächeln in den hellhäutigen Gesichtern irritiert mich an dieser Stätte .,X-STM_V_Y-EXP,inanim,an,,"abstract_obj,event,state",locative,,,
irritieren,NZZ_1993_04_02_a64_seg2_s13,6,"Was an Diebenkorns künstlerischem Werdegang irritiert , ist das mehrmalige Hinundherpendeln zwischen Figuration und Abstraktion , der er sich in den 80er Jahren nochmals in farbkräftigen Horizontalkompositionen zuwandte .",X-STM_V,inanim,an,,event(action),abstract_obj,,,
irritieren,NZZ_1993_08_23_a39_seg10_s15,25,"Der Schriftsteller Vladimir Sorokin hat ein Fazit gezogen , das wohl für viele russische « Ausreisser » Geltung haben kann : « In Russland irritieren die totale Kriminalität der Gesellschaft , das schwere Alltagsleben , die materiellen Probleme .",X-STM_V,inanim,in,"STM_coordination, EXP-indicating_adjunct","property/event,state/abstract_obj",locative,,,
irritieren,NZZ_1993_10_08_a65_seg4_s6,7,"Das Motiv dieser Heimsuchung kann nicht irritieren in einer Welt , die so Un-Menschliches zu beklagen hat wie den Baum aus Blut und Wunden .",X-STM_V,inanim,in,EXP-indicating_adjunct,abstract_obj,locative,,,(part of) piece of art
irritieren,NZZ_1993_11_13_a51_seg2_s1,41,"Lx. William W. Bartley , der sich selbst weder als « Jünger noch als Gegner » Wittgensteins versteht , hatte 1973 eine Wittgenstein-Biographie verfasst , die auch informierte Fachleute mit ihren erstaunlichen Thesen über die schwer zugängliche Persönlichkeit des Philosophen irritierte .",X-STM_V_Y-EXP,inanim,mit,,abstract_obj,abstract_obj,property,det_coref_subj,(part of) piece of art
irritieren,NZZ_1993_12_10_a63_seg2_s20,9,Die nach der Rückkehr in Basel entstandenen Werke irritieren durch das auffällige Umkippen in traditionell-ländliche Formen .,X-STM_V,inanim,durch,,"abstract_obj,concrete_obj",event,property,,(part of) piece of art
irritieren,NZZ_1994_04_02_a140_seg6_s8,6,"Denn was in ihm auch irritiert , ist nicht nur dessen stellenweise wilder Ausbruch , sondern ebenso die Tatsache , dass dieser sich nicht in den strukturellen Zusammenhang der Sonate einbauen lässt .",X-STM_V,inanim,in,,"abstract_obj,event,event(action)",ambiguous,,,proposition
irritieren,NZZ_1994_06_07_a134_seg3_s8,23,"Seine erste Visitenkarte in der Innenstadt , das anfangs heftig umstrittene Apollo-Haus am Stauffacher , eine raffinierte Antwort auf Salvisbergs Bürobauten , irritiert noch heute wegen ihrer völlig unmotivierten Ecklösung .",X-STM_V,inanim,wegen,,concrete_obj,abstract_obj,property,det_coref_subj,
irritieren,NZZ_1994_06_08_a141_seg3_s15,19,"Umspült von der Geschäftigkeit der Abfliegenden , angehaucht von der Kühle der Granit- und Stahlkonstruktion des Flughafengebäudes , irritiert Altherrs Arbeit durch Bescheidenheit , Ruhe und sachte Beharrlichkeit .",X-STM_V,inanim,durch,,ambiguous,property/property/property,,,
irritieren,NZZ_1994_07_15_a157_seg3_s6,57,"Die Geschichte des erfolglosen Drehbuchautors ( William Holden ) , der in die Fänge einer gealterten Stummfilmdiva ( Gloria Swanson ) und ihres Butlers ( Erich von Stroheim ) gerät und als deren Gefangener Schatten einer gespenstisch anmutenden Vergangenheit zum Leben erwecken soll , fasziniert durch die meisterhafte Inszenierung , wie sie durch ihre unauflösbare Erzählperspektive irritiert .",X-STM_V,inanim,durch,,abstract_obj,"abstract_obj,event(action)",property,det_coref_subj,(part of) piece of art
irritieren,NZZ_1994_12_06_a194_seg18_s8,3,"Der Hyundai irritierte uns zunächst durch sein wiegendes Kurvenverhalten und die nicht ganz so exakte Lenkung ; nach einer gewissen Gewöhnung entdeckten wir aber bald , dass die koreanische Technik auch bezüglich Sicherheitsreserven der europäischen mittlerweile sehr nahe kommt .",X-STM_V_Y-EXP,inanim,durch,,concrete_obj,property/property,,det_coref_subj/,
irritieren,NZZ_1993_02_19_a242_seg2_s11,3,"Wie Tabori irritiert auch das ZET in der Gegenüberstellung von Gegensätzlichem , der Durchdringung von tödlichem Ernst und clownesker Groteske ; mit einer Bühnenform , die die Erzählung aufbricht , fragmentiert in Prosa und Drama und in der Schwebe hält zwischen Schwank und ( romantischem ) Melodrama .",X-STM_V,clash of coordinations,in,,anim_proxy,event(action)/event(action),,,
irritieren,NZZ_1993_02_26_a152_seg2_s8,24,"Während die technisch überlegenen Südamerikaner , von Captain Maradona sowie Leo Rodriguez organisiert , verwirrende Kombinationen vortrugen und mit Kurzpässen die dänische Abwehr irritierten , wandte das skandinavische Team klassischen Konterfussball an , im Vertrauen auf die Schnelligkeit und die technischen Stärken Brian Laudrups .",X-STM_V_Y-EXP,anim,mit,EXP_anim_proxy,human,event(action),,,probably instrumental
irritieren,NZZ_1993_03_16_a116_seg3_s16,18,"Besonders die grossgewachsenen Rückraumschützen Brunner und Baumgartner bekundeten Mühe , den Gegner dank Beweglichkeit und Antritt zu irritieren und eine Überzahlsituation zu schaffen , und ermöglichten so einige folgenschwere Gegenstösse .",X-STM_V_Y-EXP,anim,dank,,human,property/property,,,Antritt may be ambiguous
irritieren,NZZ_1993_05_21_a146_seg2_s10,30,"Aber längst nicht mehr alle 400 000 Maori finden sich mit ihrem Schicksal ab , viele haben sich organisiert und pochen auf ihre Rechte als erste Siedler ,  sie irritieren damit die erdrückende Mehrheit der später Eingewanderten bzw. deren Nachkommen .",X-STM_V_Y-EXP,anim,mit,pronominal_adverb,human,event(action),,,
irritieren,NZZ_1993_10_11_a118_seg3_s11,20,"Durch leichtes Schwingen nach links und rechts suchen dann vor allem ungeübte Tiere die richtige Absprungstelle , zögern und irritieren dadurch auch die Gegner .",X-STM_V_Y-EXP,anim,durch,pronominal_adverb,animal,event(action),,,?
irritieren,NZZ_1993_11_18_a110_seg9_s4,11,Und nur wenig später touchierte Herr einen Freistossball Bregys und irritierte damit die gesamte gegnerische Verteidigung : 2 : 0 .,X-STM_V_Y-EXP,anim,mit,"pronominal_adverb, EXP_anim_proxy",human,event(action),,,instrumental?
irritieren,NZZ_1993_11_29_a104_seg2_s19,17,"Plötzlich schien sie an ihre Chance zu glauben , steigerte sich individuell wie als Equipe und irritierte dadurch den fast etwas nonchalant gewordenen Gegner .",X-STM_V_Y-EXP,anim,durch,pronominal_adverb,human,event(action),,,
irritieren,NZZ_1993_12_13_a184_seg2_s4,11,"Was den Komponisten am « schulischen Dogma » vorab zu irritieren scheint , dürfte in der latenten Gefahr eines kompositionstechnischen Selbstzwecks zu orten sein .",X-STM_V_Y-EXP,ambiguous,an,,ambiguous,abstract_obj,,,
irritieren,NZZ_1994_06_02_a103_seg5_s3,30,"Solschenizyn kam als eine Art Übervater des Antikommunismus , er bezeichnete seine Rückkehr als Anfang einer möglichen Rettung Russlands ( stellt also unerfüllbare Ansprüche an sich selber ) und irritierte zudem durch eine eigenartige , unangenehme Heuchelei : Er beklagte sich heftig über die « Belästigung » durch die Medien , inszenierte anderseits aber seine Rentrée in grossem Stil und verkaufte die Filmrechte an die BBC .",X-STM_V,anim,durch,,human,event(action),,,
irritieren,NZZ_1994_12_03_a109_seg3_s50,29,"Er isoliert , schneidet an , blickt von oben oder ganz unten auf sein Gegenüber , öffnet den Innenraum in Weitwinkelperspektive , gestaltet aus Nah- und Schrägsicht , irritiert mit Spiegeln und verdeckten Lichtquellen , skizziert und arbeitet aus .",X-STM_V,ambiguous,mit,,ambiguous,concrete_obj/concrete_obj,,,
langweilen,NZZ_1994_10_14_a160_seg11_s1,6,"An dieser Form der Medienkritik langweilt nicht nur die Monotonie der in einer Endlosschleife wiederkehrenden Leitmotive , die allesamt zum Repertoire traditioneller Kulturkritik gehören .",X-STM_V,inanim,an,,"abstract_obj,state",abstract_obj,,,
langweilen,NZZ_1996_06_13_a166_seg2_s7,25,"Sie arbeiten zusammen , um Synergien zu nutzen und um sich nicht in abendfüllenden Stücken zu verstricken , die schliesslich ihrer Überlänge wegen alle langweilen .",X-STM_V_Y-EXP,inanim,wegen,,abstract_obj,property,,det_coref_subj,(part of) piece of art
langweilen,NZZ_1996_09_26_a147_seg3_s22,5,"Zugegeben , politische Korrektheit langweilt im Theater .",X-STM_V,inanim,in,ambiguous,abstract_obj,locative,,,
langweilen,NZZ_1998_02_23_a141_seg2_s9,3,"Die Songs langweilen den Konzertbesucher trotzdem nicht durch folkige Wortlastigkeit , sondern kommen in einfallsreichen und eingängigen Popmelodien daher .",X-STM_V_Y-EXP,inanim,durch,,abstract_obj,property,,,(part of) piece of art
