Verb,NZZ_ID,Token_ID,Sentence,pattern,Stimulus_Type,Stimulus_PP,Comment,sem_class_subj,sem_class_PP_int,interpr_sem_class_PP_int,det_PP_int,Comment_PP
verärgern,NZZ_1993_11_12_a80_seg2_s19,58,"Aus der Sicht vernünftiger Bürger drängt sich jedoch immer dringlicher die Frage nach der Aufgabe der nationalen Gesundheitsbehörde auf : Hätte sie nicht , statt die mit Gesundheitsfragen hautnah sich Befassenden entweder durch Verzögerungstaktik zu behindern oder aber mit kontraproduktiver Vermarktung à la « Kinder vom Bahnhof Zoo » durch immer neue hausgemachte « Spezialisten » zu verärgern , schlicht und sachlich die Anliegen der Verelendeten oder zumindest ihrer Anwälte wahrzunehmen ?",X-STM_V_Y-EXP,anim_proxy,mit,,anim_proxy,"abstract_obj,event(action)",,,
verärgern,NZZ_1993_11_26_a132_seg2_s29,17,"Bereits letzte Saison hatte er durch einen Blitzwechsel zum früheren Ausrüster Atomic dessen Hausherrn Franz Heinzer verärgert , der sich nicht allzu sehr über weitere interne Konkurrenz freute .",X-STM_V_Y-EXP,anim,durch,,human,event(action),,,
verärgern,NZZ_1993_12_08_a154_seg6_s3,4,"In der Vergangenheit verärgerte die Gemeinschaft mit ihrer subventionsgestützten Agrarpolitik nicht nur die USA , sondern zunehmend auch die übrigen Welthandelsnationen .",X-STM_V_Y-EXP,anim_proxy,mit,EXP_anim_proxy,anim_proxy,abstract_obj,,det_coref_subj,indicates proposition
verärgern,NZZ_1994_01_11_a121_seg4_s14,19,"Wehrli ist sich durchaus bewusst , dass er zuweilen undiplomatisch agiert und seine Umgebung mit wenig gewählten Worten verärgert .",X-STM_V_Y-EXP,anim,mit,,human,abstract_obj,,,utterance
verärgern,NZZ_1994_02_19_a158_seg3_s12,15,"Freilich sind aber nur wenige Trainer bereit , durch unpopuläre Entscheide die Clientèle zu verärgern .",X-STM_V_Y-EXP,anim,durch,,human,"abstract_obj,event(action)",,,
verärgern,NZZ_1994_05_04_a20_seg3_s9,71,"Die Iraner sollen der IRA eine Abschussliste vorgelegt haben , auf welcher drei Persönlichkeiten figurieren : der seit 1981 im französischen Exil lebende frühere iranische Ministerpräsident Bani Sadr , Javad Dabiran , ein Sprecher der oppositionellen in Bonn domizilierten Volksmujahedin und die prominente in London wohnhafte Schauspielerin Farzaneh Taidi , welche die Iraner mit ihrer Rolle im Film « Not Without my Daughter » über eine Amerikanerin im postrevolutionären Iran verärgert hatte .",X-STM_V_Y-EXP,anim,mit,,human,abstract_obj,,det_coref_subj,(part of) piece of art
verärgern,NZZ_1994_05_16_a126_seg7_s5,23,"Wollte er die Sponsoreninteressen wahrnehmen , hätte er möglichst oft gewinnen müssen , die erfolglosen Gegner und die Spanier damit jedoch laufend verärgert .",X-STM_V_Y-EXP,anim,mit,pronominal_adverb,human,abstract_obj,,,proposition
verärgern,NZZ_1994_05_27_a210_seg2_s13,40,"Auch die Deutschschweizer fanden , nur eine Persönlichkeit wie Ador könne bei den Kriegsparteien das Vertrauen in die Schweiz wiederherstellen , nachdem Hoffmann durch seine Unterstützung der Aktivitäten Robert Grimms zugunsten eines Separatfriedens zwischen Deutschland und Russland die Alliierten verärgert hatte und Zweifel an der Neutralität der Schweiz hatte aufkommen lassen .",X-STM_V_Y-EXP,anim,durch,EXP_anim_proxy,human,event(action),,det_coref_subj,
verärgern,NZZ_1994_08_11_a29_seg3_s3,14,"Mit diesem Schwenker um 180 Grad hatte der Präsident liberale Gesetzgeber im Kongress verärgert , die auf einer Verknüpfung von Handel und Menschenrechten beharrten .",X-STM_V_Y-EXP,anim,mit,,human,event(action),,,
verärgern,NZZ_1994_09_12_a77_seg3_s7,54,"Dann gibt es die überraschenden Begegnungen , die einem alle liebgewordenen Vorurteile über den Haufen werfen : Woody Allen , der heiss Verehrte und seit je mit Fäusten und Füssen Verteidigte , schaffte es doch tatsächlich , mit seinem « Bullets Over Broadway » nicht nur zu langweilen , sondern auch noch zu verärgern .",X-STM_V,anim,mit,,human,abstract_obj,,det_coref_subj,(part of) piece of art
verärgern,NZZ_1994_11_09_a151_seg3_s21,19,"Nach dem letzten Pfiff des unsicheren Head , der gemessen am internationalen Standard beide Equipen mit kleinlichen Entscheiden verärgerte , zerschmetterte der Florida-Rückkehrer seine Stockschaufel auf dem Eis - eine Geste der puren Verzweiflung .",X-STM_V_Y-EXP,anim,mit,EXP_anim_proxy,human,"abstract_obj,event(action)",,,
verärgern,NZZ_1995_01_11_a71_seg8_s10,13,"Der Handelsbeauftragte Mickey Kantor hat die Japaner mit der Einleitung eines Sanktionsverfahrens verärgert , das allerdings nur auf den Autoersatzteilmarkt abzielt und somit eher symbolischen Charakter hat .",X-STM_V_Y-EXP,anim,mit,,human,event(action),,,
verärgern,NZZ_1995_01_13_a111_seg7_s11,2,"Bockris verärgert zwar mit seiner etwas gar exponierten Meinung über Reeds ausserordentliche Bedeutung , aber als Schilderung eines ganz besonders unberechenbaren Rocklebens hat er ein respektables Stück Arbeit geleistet .",X-STM_V,anim,mit,,human,abstract_obj,,det_coref_subj,utterance
verärgern,NZZ_1995_04_05_a3_seg6_s4,12,"Präsident Clinton hatte den britischen Regierungschef im März mit der Entscheidung verärgert , den politischen Führer der radikalen Katholiken in Ulster , Gerry Adams , an einen Empfang zum St. Patrick ' s Day ins Weisse Haus einzuladen und ihm die Bewilligung zum Geldsammeln für seine Sinn-Fein-Partei zu erteilen .",X-STM_V_Y-EXP,anim,mit,,human,"abstract_obj,event(action)",,,
verärgern,NZZ_1995_04_20_a67_seg6_s12,7,"Obwohl der US-Handelsbeauftragte Kantor damit Tokio verärgert hat - seither ist das Handelsministerium federführend in den Gesprächen - , hat die Drohgebärde offenbar doch bewirkt , dass die Japaner jetzt bereit sind , den Ersatzteilmarkt überhaupt mit in die Gespräche einzubeziehen .",X-STM_V_Y-EXP,anim,mit,"pronominal_adverb,metonymic_EXP",human,ambiguous,,,
verärgern,NZZ_1995_04_25_a145_seg2_s1,29,Die englische « Football Association » ( Fussballverband ) hat durch eine verfehlte Terminplanung das in der Schlussphase des Championnats schon übliche Spielprogramm-Chaos vertieft und die betroffenen Klubs verärgert .,X-STM_V_Y-EXP,anim_proxy,durch,"ambiguous,EXP_anim_proxy",anim_proxy,event(action),,,
verärgern,NZZ_1995_05_04_a210_seg13_s11,4,Mit solchen Aussagen verärgert der Chef des staatlichen Lehrmittelverlags des Kantons Zürich einige seiner Konkurrenten aus der Privatwirtschaft .,X-STM_V_Y-EXP,anim,mit,,human,"abstract_obj,event(action)",,,utterance
verärgern,NZZ_1995_05_06_a77_seg6_s5,52,"Da die regierende Konservative Partei bei den Lokalwahlen in England und Wales bemerkenswert schwere Verluste erlitten hatte , worin sich die ausserordentlich ausgeprägte Unbeliebtheit der Regierung Major spiegelt , habe Clarke den Wähler nicht durch straffer geführte geldpolitische Zügel , die vermutlich zu einer Erhöhung der Hypothekarzinsen geführt hätten , zusätzlich verärgern wollen .",X-STM_V_Y-EXP,anim,durch,,human,abstract_obj,event(action),,interpreted as action in cotext
verärgern,NZZ_1995_05_11_a76_seg3_s7,34,"Umgekehrt wird die Geschäftswelt im neuen Fiskaljahr mit rund 500 Mio. $ an neuen Steuern belastet , derweil die Provinzregierung versucht , den ( noch unentschlossenen ) Stimmbürger nicht mit höheren Einkommenssteuern zu verärgern .",X-STM_V_Y-EXP,anim_proxy,mit,,anim_proxy,abstract_obj,,,
verärgern,NZZ_1995_05_22_a130_seg3_s5,38,"Es war aber auch eine Partie , in der Schiedsrichter und - vor allem - Linienrichter lange Zeit mit unverständlichen Entscheiden allzu sehr das Interesse auf sich zogen und die 7500 Zuschauer und die Spieler beider Mannschaften verärgerten .",X-STM_V_Y-EXP,anim,mit,"EXP_coordination, ambiguous",human,"abstract_obj,event(action)",,,
verärgern,NZZ_1995_06_06_a165_seg2_s1,12,"Radio DRS legt wirklich alles darauf an , seine Hörer zu verärgern - mit « Kleinigkeiten » , die einem tagtäglich das Hören vergällen .",X-STM_V_Y-EXP,anim_proxy,mit,,anim_proxy,ambiguous,,,
verärgern,NZZ_1995_06_14_a31_seg8_s13,11,Sitten hatte mit einem wenig diplomatischen Auftritt die anderen Gemeinden verärgert .,X-STM_V_Y-EXP,anim_proxy,mit,EXP_anim_proxy,anim_proxy,event(action),,,
verärgern,NZZ_1995_06_23_a39_seg14_s7,2,"Sie verärgerten damit jene ihrer Bundesräte , die Otto Stich unterstützt und sich mit einem unpopulären Entscheid exponiert hatten .",X-STM_V_Y-EXP,anim,mit,pronominal_adverb,human,ambiguous,,,
verärgern,NZZ_1995_07_26_a31_seg5_s4,13,"Mit den bisherigen Protestpausen hat das BVB-Fahrpersonal nicht nur die städtischen Fahrgäste verärgert , sondern auch jene der Baselland Transport ( BLT ) , die ihre Linien zum Teil durch die Stadt führt .",X-STM_V_Y-EXP,anim,mit,,human,event,event(action),,by making a break
verärgern,NZZ_1995_08_04_a174_seg2_s1,19,"fre. Als hätte es nicht genügt , die Sammler mit der bereits erschienenen « Jubiläumsmarken » -Serie zu verärgern , muss am 5. September auch noch für die vom 3. bis zum 11. Oktober stattfindende « Telecom 95 » in Genf eine Sondermarke erscheinen .",X-STM_V_Y-EXP,anim,mit,,human,concrete_obj,"concrete_obj,event(action)",,abstract?
verblüffen,NZZ_1993_08_07_a182_seg3_s23,14,An der Verfilmung des Erstlingsromans von Ian McEwan durch seinen Landsmann Andrew Birkin verblüfft die atmosphärische und erzählrhythmische Nähe zum Text .,X-STM_V,inanim,an,,property,abstract_obj,,,(part of) piece of art
verblüffen,NZZ_1993_10_16_a209_seg5_s8,9,Der Dokumentarfilm ( Kamera : Hugues Ryffel ) verblüfft durch seine Verbeugung vor den so ganz anderen Möglichkeiten der Photographie .,X-STM_V,inanim,durch,,abstract_obj,event(action),property,det_coref_subj,(part of) piece of art
verblüffen,NZZ_1994_07_29_a131_seg3_s2,48,"Die Pizzerie können sich vermehren und die Spaghetterie sich vervielfachen , so lange sie wollen , ein Restaurant wie das Piccoli Accademia , das die klassische italienische Kochkunst pflegt , wird immer eine grosse Stammkundschaft haben , die eine Küche schätzt , die nicht durch ausgeflippte Kreationen verblüfft , sondern vor allem den Genuss des Wiedererkennens glücklicher Geschmackskombinationen vermittelt .",X-STM_V,inanim,durch,,abstract_obj,"abstract_obj,event(action)",property,,
verblüffen,NZZ_1994_06_08_a142_seg3_s8,29,"Zusammen mit Begleitmusikern aus den USA und Mali haben sie musikalische Themen so behutsam aufgebaut , variiert und zurückhaltend ausgeschmückt , dass diese durch ihre Homogenität und Entspanntheit verblüffen .",X-STM_V,inanim,durch,,abstract_obj,property/property,,det_coref_subj,
verblüffen,NZZ_1995_04_20_a160_seg2_s5,4,An der Leistung verblüfft jedoch wohl am meisten das Fehlen jeglicher schwächeren Phasen seit dem Start des Championats im vergangenen August .,X-STM_V,inanim,an,,property,"abstract_obj,event(action)",,,
verblüffen,NZZ_1996_04_23_a247_seg3_s5,3,Geniale Erfindungen verblüffen oft durch ihre Einfachheit .,X-STM_V,inanim,durch,,abstract_obj,property,,det_coref_subj,
verblüffen,NZZ_1996_08_29_a201_seg4_s11,57,"Seine Überlegungen von damals liegen auch der jetzigen Überbauung zugrunde : « Mehrung der Natur als Antwort auf die Zersiedelung der Landschaft , Leben in Harmonie mit der Natur , Verwirklichung der Sehnsucht nach Romantik und Kreativität , mehr Lebensqualität für die Anrainer und nicht nur für die Bewohner ... » Die « hügelversetzten Häuser » verblüffen und bestechen durch grasbewachsene , « bewander- und bewandelbare » Dächer , heiter stimmende Farben und runde , sanfte Formen im Sinne der « nicht reglementierten Unregelmässigkeiten » , die zu einem menschen- und naturgerechten Leben in Geborgenheit und Harmonie verhelfen sollen .",X-STM_V,inanim,durch,,concrete_obj,concrete_obj/property/property,property/property/property,,
verblüffen,NZZ_1996_06_11_a170_seg3_s21,10,"Die Ausstellung bietet den Besuchern nicht eigentlich Neues , verblüfft aber wiederholt mit Unerwartetem .",X-STM_V,inanim,mit,,"abstract_obj,event(action)",abstract_obj,property,,(part of) piece of art
verblüffen,NZZ_1996_05_30_a150_seg3_s9,4,"Die vielschichtigen Texte verblüffen auch weniger durch Introspektion als durch den kontrastiven Wechsel der Tonlage : die generell um Distanz bemühten und eigentlich von jedem Pathos freien Erkundungen werden dann schon mal durch ein kulturpessimistisches , ja grimmiges Credo konterkariert - etwa , wenn Gracq notiert :",X-STM_V,inanim,durch,,abstract_obj,event(action)+event(action),property+property,,(part of) piece of art
verblüffen,NZZ_1997_12_16_a196_seg3_s3,29,"Mit der neuen YZF-R1 distanziert Yamaha die etablierten Mitbewerber gleich in allen drei Kategorien : Das kompromissloseste aller 1000er-Superbikes wiegt leer 177 kg , leistet 150 PS und verblüfft mit dem spielerisch leichten Handling einer 600er .",X-STM_V,inanim,mit,,concrete_obj,property,,,
verblüffen,NZZ_1998_12_28_a133_seg6_s1,14,Die erste Szene in Andreas Kriegenburgs « Sturm » -Inszenierung am Schauspiel Hannover verblüfft durch den schlagenden Einfall ebenso wie durch die formale Strenge .,X-STM_V,inanim,durch,,event,property+property,,,(part of) piece of art
verblüffen,NZZ_1999_12_17_a202_seg8_s10,7,Vor allem « Köln Extra » verblüfft durch einen in diesem Kontext umfangreichen Politikteil und durch selbstrecherchierte Lokalgeschichten in einem professionell anmutenden Layout .,X-STM_V,inanim,durch,,abstract_obj,abstract_obj+abstract_obj,property+property,,
verblüffen,NZZ_1999_01_28_a170_seg7_s30,3,"Dieser Erfolg verblüfft vor allem deswegen , weil Göläs rockige und teilweise auch holprige Songs zwar eingängig sind und mit einer frischen Direktheit beeindrucken , aber weder musikalisch noch textlich originell sind .",X-STM_V,inanim,wegen,pronominal_adverb,abstract_obj,property,,,
verblüffen,NZZ_1999_03_05_a279_seg2_s7,15,Sein in Sturm und Drang geschriebener Erstling « Die Leiden des jungen Mehrwerthers » verblüfft durch die verhaltene Kühnheit der Szenarienführung .,X-STM_V,inanim,durch,,abstract_obj,property,,,(part of) piece of art
verblüffen,NZZ_1993_07_06_a58_seg3_s5,11,Der mit einer wild card ins Tableau genommene Schweizer Davis-Cup-Spieler verblüffte die Zuschauer mit einer für ihn völlig atypischen Spielweise im ersten Satz .,X-STM_V_Y-EXP,anim,mit,,human,abstract_obj,property,,
verblüffen,NZZ_1993_04_22_a89_seg5_s3,32,"Frühere Uhren liefen nicht mehr , liess man sie fallen ; mit seinem guten Gefühl für Public Relations liess er in einflussreicher Gesellschaft daher eine seiner ersten stossgesicherten Uhren fallen und verblüffte damit seine potentielle Kundschaft .",X-STM_V_Y-EXP,anim,mit,pronominal_adverb,human,event(action),,,
verblüffen,NZZ_1993_08_07_a116_seg2_s7,14,"Die Konkurrenz über die lange Bruststrecke war auch aus Schweizer Sicht interessant , verblüffte doch der Tessiner Marco Minonne am Morgen in den Vorläufen mit einer Zeit von 2 : 18,36 .",X-STM_V,anim,mit,,human,abstract_obj,property,,
verblüffen,NZZ_1993_02_12_a67_seg2_s11,22,"Pudowkin vermochte mit einfachen , ja naiven Geschichten , die voller Dramatik erzählt waren , Filmästheten ebenso wie einfache Zuschauer zu verblüffen .",X-STM_V_Y-EXP,anim,mit,EXP_coordination,human,abstract_obj,,,(part of) piece of art
verblüffen,NZZ_1993_03_15_a134_seg6_s3,2,"Sie verblüffte trotz der psychischen Belastung , vor 4000 Norwegern ein Auswärtsspiel austragen zu müssen , durch Unbeschwertheit , Spielintelligenz und Selbstsicherheit , die in dieser zuvor wenig stabilen Equipe verblüffen mussten .",X-STM_V,anim_proxy,durch,,anim_proxy,property/property/property,,,
verblüffen,NZZ_1993_09_06_a79_seg4_s2,11,"Angesichts der Genialität , mit welcher der Spanier die Zuschauer verblüffte , zählte selbst der Crans-Sieger Berry Lane zum unauffälligen Rest des insgesamt gehaltvollen Treffens eines nicht unerheblichen Teils der Golf-Weltklasse .",X-STM_V_Y-EXP,anim,mit,,human,property,,,
verblüffen,NZZ_1993_09_06_a163_seg2_s4,52,"Otto Meyer-Spelbrink , der die Fahrzeuge präsentierte , dürfte durch seine umfassenden Fachkenntnisse über Geschichte und Technik jedes Modells , aber auch durch sein Wissen um das gesellschaftliche Umfeld der « Ami-Schlitten » vorwiegend aus den fünfziger und sechziger Jahren , spontan und unterhaltend vorgetragen , selbst ausgekochte Kenner der Szene verblüfft haben .",X-STM_V_Y-EXP,anim,durch,,human,abstract_obj+abstract_obj,property+property,det_coref_subj+det_coref_subj,
verblüffen,NZZ_1993_09_11_a69_seg4_s11,5,"In den fünfziger Jahren verblüffte mich ein Düsseldorfer Taxifahrer mit dem Satz : « Wenn ich die Vorfahrt immer beachten wollte , müsste ich verhungern , und Sie bekämen ihren Zug nicht ! »",X-STM_V_Y-EXP,anim,mit,,human,abstract_obj,event(action),,utterance
verblüffen,NZZ_1994_04_05_a104_seg4_s10,25,"Abgesehen vom Finale des Solokonzerts , wo die Holzbläser dem quirlig-virtuosen Thomas Zehetmair nicht mehr zu folgen vermochten , spielte das Orchester untadelig und verblüffte gar verschiedentlich mit besonders zarten Pianissimi .",X-STM_V,anim_proxy,mit,,anim_proxy,event(action),,,(part of) piece of art
verblüffen,NZZ_1994_07_07_a151_seg3_s5,27,"Mit ihrem feurigen Temperament , das mitunter neben Klang auch viel Geräusch erzeugte , ging die junge Geigerin die virtuosen , rhythmisch betonten Partien an , verblüffte aber auch mit raschen , feinsinnigen Farbwechseln und bewies mit ihrer expressiven Gestaltung der langsamen Tzigane-Einteilung bereits ein hohes Mass an künstlerischer Reife .",X-STM_V,anim,mit,,human,event(action),,,(part of) piece of art
verblüffen,NZZ_1994_10_31_a108_seg3_s11,2,"Papp verblüffte nicht nur mit wachen Reflexen , sondern mit pragmatischer , jeglicher Effekthascherei entbehrender Spielweise - ein Versprechen für die Zukunft .",X-STM_V,anim,mit,,human,property/property,,,
verblüffen,NZZ_1994_10_07_a150_seg3_s20,19,"Mit ihrem traditionellen Hang zum Spiel durch die Mitte , vor allem aber mit ihrer Selbstsicherheit und Ausgeglichenheit verblüfften sie zahlreiche Beobachter .",X-STM_V_Y-EXP,anim,mit,,human,property/property,,det_coref_subj,
verblüffen,NZZ_1994_10_11_a149_seg3_s2,10,"Seit einem Vierteljahrhundert steht sie auf den Weltbühnen , verblüfft immer wieder von neuem mit der schwerelosen Leichtigkeit und der lockeren Präsenz ihrer Stimme .",X-STM_V,anim,mit,,human,property/property,,,complex case: not a property of the subject but her voice. That hervoice has these properties is the property predicated of the subject
verblüffen,NZZ_1994_10_22_a166_seg2_s3,7,Die 1967 in Detroit geborene Pianistin verblüffte gleich in drei verschiedenen Stilepochen mit ihrer überaus brillanten Klaviertechnik .,X-STM_V,anim,mit,,human,abstract_obj,property,det_coref_subj,
verblüffen,NZZ_1994_09_15_a106_seg3_s13,37,"Die Gegenposition zu diesem Möbelkünstler nimmt das auch innenarchitektonisch erfolgreiche Dreierteam Atelier Oï aus La Neuveville ein , das mit eigenwilligen Barhockern , einem Tetrapack- « Stellmöbel » und dem japanisch anmutenden Bett « Dive » verblüfft .",X-STM_V,anim_proxy,mit,,anim_proxy,concrete_obj/concrete_obj/concrete_obj,,,(part of) piece of art
verblüffen,NZZ_1994_08_31_a111_seg3_s10,27,"Martin R. Deans Können zeigt sich erneut in einer « Schlaufe » aus dem Roman « Der Guyanaknoten » , und der 1916 geborene Georg Risi verblüfft mit aberwitziger quasichinesischer Kürzestprosa .",X-STM_V,anim,mit,,human,abstract_obj,,,(part of) piece of art
verblüffen,NZZ_1995_04_13_a183_seg7_s3,2,Dafür verblüffte der FC Basel mit einem Kantersieg gegen Lausanne den eigenen Anhang .,X-STM_V_Y-EXP,anim_proxy,mit,,anim_proxy,event,,,
verblüffen,NZZ_1995_04_27_a176_seg2_s9,13,Mit dem atmosphärischen Blues seines Début-Albums hatte Chris Whitley 1991 die Fachwelt verblüfft .,X-STM_V_Y-EXP,anim,mit,EXP_anim_proxy,human,abstract_obj,property,,(part of) piece of art
verblüffen,NZZ_1995_03_31_a233_seg3_s15,8,"Zum 200-Jahr-Jubiläum der Volkszählung in Norwegen 1969 verblüffte er mit einem ( realisierten ) Entwurf , der Lochkarten und stilisierte Menschen vereinigte .",X-STM_V,ambiguous,mit,,human,abstract_obj,,,(part of) piece of art
verblüffen,NZZ_1995_08_16_a118_seg4_s5,46,"Letzteres hat nur am Rande mit einem Rentier oder sonstigen Tier zu tun , sondern mit einer attraktiven Dame , die eine Riesenschlange um sich windet oder gleich der Puppe Olympia in « Hoffmanns Erzählungen » mit mechanisch abgezirkelten Bewegungen und starrblickenden Augen das Publikum verblüfft .",X-STM_V_Y-EXP,anim,mit,,human,event(action)/concrete_obj,event(action)/event(action),,(part of) piece of art
verblüffen,NZZ_1995_02_01_a146_seg19_s1,17,"Selten , aber doch ab und zu tauchen junge Musiker aus der musikindustriellen Masse auf und verblüffen mit der selbstverständlich wirkenden Ausgereiftheit alter Meister .",X-STM_V,anim,mit,,human,property,,,(part of) piece of art
verblüffen,NZZ_1995_07_10_a140_seg4_s7,3,"In Belgien verblüffte Miguel Indurain die Konkurrenz am Wochenende mit einer neuen Taktik , dank der er endgültig das Image des Defensivkünstlers losgeworden sein dürfte ; denn was Indurain in der Etappe von Charleroi nach Lüttich zeigte , war aussergewöhnlich .",X-STM_V_Y-EXP,anim,mit,,human,abstract_obj,event(action),,
verblüffen,NZZ_1995_05_13_a119_seg11_s4,14,"Ganz ohne Flügel , Seile oder Kameratricks schwebt er durch den Raum und verblüfft damit nicht nur das Showpublikum .",X-STM_V_Y-EXP,anim,mit,pronominal_adverb,human,event(action),,,
verblüffen,NZZ_1995_03_13_a163_seg11_s2,6,"Die Kanadier Bourne/Kraatz als Vierte verblüfften mit extrem schwierigen Passagen nur wenige Zentimeter über der Eisfläche , in denen sie wie Luftkissenboote zu schweben scheinen .",X-STM_V,anim,mit,,human,event,event(action),,(part of) piece of art
verblüffen,NZZ_1995_11_04_a197_seg4_s1,24,"Es ist sicher kein Zufall , dass es ausgerechnet Giorgio Manganelli gelungen ist , seine Leser auch nach dem Tod durch Neuerscheinungen zu verblüffen .",X-STM_V_Y-EXP,anim,durch,,human,"abstract_obj,event",,,(part of) piece of art
verblüffen,NZZ_1995_11_13_a140_seg3_s11,38,"Wie auch immer : Briggers Team stand jedenfalls im Zentrum der Defensive ( Wolf , van Eck ) hervorragend , wies im Aufbau besonders vor der Pause Vorteile gegenüber dem Platzklub auf ( der knapp 18jährige Seoane verblüffte lange mit stupender Zuspiel- und Ballsicherheit ) , und im Angriff bildeten Alexandrow ( er hatte bereits nach zehn Minuten das 1 : 0 erzielt ) und Sawu eine ständige Gefahr .",X-STM_V,anim,mit,,human,property/property,,,
verblüffen,NZZ_1996_12_13_a19_seg10_s10,29,"« Wer im Namen dieser Nation und dieses Staates schiesst oder sein Blut vergisst , wird von uns immer mit Respekt bedacht » , sagte Frau Ciller und verblüffte damit die Öffentlichkeit .",X-STM_V_Y-EXP,anim,mit,pronominal_adverb,human,"abstract_obj,event(action)",,,utterance
verblüffen,NZZ_1996_02_01_a144_seg3_s6,6,- Der Wissenschafter Rupert Sheldrake verblüfft die Fachwelt mit der Theorie von hellseherischen Fähigkeiten von Hund und Katze .,X-STM_V_Y-EXP,anim,mit,EXP_anim_proxy,human,abstract_obj,,,event(action) (utterance)?
verblüffen,NZZ_1996_07_22_a140_seg5_s23,14,"Der noch nicht 23jährige Jan Ullrich erstaunte mit zunehmender Dauer immer mehr und verblüffte mit dem Sieg im Zeitfahren von St-Emilion alle , weil er Riis doch noch recht nahe rückte .",X-STM_V_Y-EXP,anim,mit,,human,event,,,
verblüffen,NZZ_1996_05_11_a200_seg2_s4,15,"Und der junge Schlagzeugvirtuose Bill Stewart , der mit seinen polyrhythmischen Kunststückchen männiglich zu verblüffen weiss .",X-STM_V,anim,mit,,human,abstract_obj,event(action),det_coref_subj,(part of) piece of art
verblüffen,NZZ_1996_03_13_a151_seg5_s4,17,"Der Mann hat sich ganz auf Manipulationen mit feinen Gummibändchen spezialisiert , und an der Medienkonferenz verblüffte er die Anwesenden mit seiner Kunst ebenso wie Louis Marino , pensionierter Bestattungsbeamter , der aus einem Bündel Papier im Handumdrehen Hunderternoten entstehen liess .",X-STM_V_Y-EXP,anim,mit,,human,abstract_obj,,det_coref_subj,(part of) piece of art
verblüffen,NZZ_1996_03_26_a127_seg4_s43,20,"Wenn er mit seiner eigenen Phantasie auf Bizets « Carmen » oder mit Sousas « Stars and Stripes » verblüffte , so engagierte er sich gleichzeitig für Kabalewski und Samuel Barber , für Poulenc und - immer nachhaltiger - für den « Mystiker » Alexander Skrjabin .",X-STM_V,anim,mit,,human,abstract_obj,property,det_coref_subj,
verblüffen,NZZ_1997_08_29_a172_seg2_s5,14,"1993 kopierte die Bloodhound Gang noch den Technopop von Depeche Mode , nun verblüfft die Band aus Philadelphia mit einem humorvollen Crossover-Mix von Rock und Rap .",X-STM_V,anim_proxy,mit,,anim_proxy,abstract_obj,,,(part of) piece of art
verblüffen,NZZ_1997_12_20_a232_seg3_s18,10,"Sylviane Berthod , die zweifache Junioren-Weltmeisterin im Super-G , verblüffte in ihrem zweiten Weltcup-Riesenslalom mit einem 17. Platz .",X-STM_V,anim,mit,,human,abstract_obj,event,,event?
verblüffen,NZZ_1997_02_18_a109_seg3_s5,36,"Folkloristische Schritte mischen sich mit dem fliessenden Beugen und Dehnen , mit dem Fallen und Wiederaufrichten aus der Tradition Doris Humphreys und den quirligen Verkettungen , mit denen Richard Wherlock bereits am ersten Luzerner Ballettabend verblüfft hatte .",X-STM_V,anim,mit,,human,event(action),,,(part of) piece of art
verblüffen,NZZ_1997_07_04_a229_seg8_s8,11,"Den Effekt des Urwaldes , mit dem Nouvel die Jury verblüffte , haben Portzamparcs Innenhöfe nicht .",X-STM_V_Y-EXP,anim,mit,,human,abstract_obj,,,(part of) piece of art
verblüffen,NZZ_1997_06_03_a170_seg3_s9,3,"Oxalagu indessen verblüffte mit dem Erfolg sogar Trainer Bruno Schütz , der momentan an den Rücktritt denkt .",X-STM_V_Y-EXP,anim,mit,,human,"abstract_obj,event",event,,
